{
  "$schema": "https://json-schema.org/draft/2020-12/schema",
  "$id": "catalog.palettes.schema.json",
  "type": "object",
  "additionalProperties": false,
  "required": ["id", "createdAt", "updatedAt", "palettes"],
  "properties": {
    "id": { "type": "string", "minLength": 1 },
    "createdAt": { "type": "string", "format": "date-time" },
    "updatedAt": { "type": "string", "format": "date-time" },
    "palettes": {
      "type": "array",
      "minItems": 1,
      "items": {
        "type": "object",
        "additionalProperties": false,
        "required": ["id", "label", "colors"],
        "properties": {
          "id": { "type": "string", "minLength": 1 },
          "label": { "type": "string", "minLength": 1 },
          "description": { "type": "string" },
          "colors": {
            "type": "array",
            "minItems": 1,
            "items": {
              "type": "string",
              "pattern": "^#[0-9A-Fa-f]{6}([0-9A-Fa-f]{2})?$",
              "description": "Hex color in #RRGGBB or #RRGGBBAA."
            }
          },
          "promptTokens": { "type": "array", "items": { "type": "string" } }
        }
      }
    }
  }
}
