{
  "id": "palettes",
  "createdAt": "2026-02-03T00:00:00.000Z",
  "updatedAt": "2026-02-03T00:00:00.000Z",
  "palettes": [
    {
      "id": "astroduck_neon",
      "label": "AstroDuck Neon",
      "description": "High contrast comic palette with neon accents.",
      "colors": [
        "#0B1020",
        "#EEF2FF",
        "#6D7CFF",
        "#00E5FF",
        "#FF3D71",
        "#FFB300",
        "#22C55E"
      ],
      "promptTokens": [
        "neon accents",
        "high contrast"
      ]
    }
  ]
}
